{"chainWorld":{"kind":"https://jinn.network/records/chain-environment/1.0","record":{"digest":{"sha256":"adb4d580f8f37c4c129b97c7dc4e103eb1b368213fc24cc7b169d02013cbe75d"},"name":"chain"}},"composition":{"endpointAllowlist":[],"missPolicy":{"mode":"declared-response","status":404},"originRouting":[],"requestBudget":{"maxRequests":0,"maxResponseBytes":0}},"informationWorlds":[],"kind":"https://jinn.network/records/crypto-environment/1.0","serviceRuntimes":[]}